<?xml version="1.0" encoding="UTF-8" ?>

<!--
  - Copyright 2009 Vladimir Ritz Bossicard
  -
  - This file is part of Configo.
  -
  - Configo is free software: you can redistribute it and/or modify it under the
  - terms of the GNU General Public License as published by the Free Software
  - Foundation, either version 3 of the License, or (at your option) any later
  - version.
  -
  - This program is distributed in the hope that it will be useful, but WITHOUT
  - ANY WARRANTY; without even the implied warranty of MERCHANTABILITY or
  - FITNESS FOR A PARTICULAR PURPOSE. See the GNU General Public License for
  - more details.
  -
  - You should have received a copy of the GNU General Public License along with
  - this program. If not, see <http://www.gnu.org/licenses/>.
  -
  - Author      : Vladimir Ritz Bossicard
  - Version     : $Revision: 131 $
  - Last edit   : $Date: 2009-04-21 13:26:37 +0200 (Tue, 21 Apr 2009) $
  - Last editor : $Author: vbossica $
  -->

<!DOCTYPE configuration PUBLIC "-//WorkingOnIt/Configo Configuration DTD 1.0//EN" "configo.dtd" >

<configuration>
    <name>Configo</name>
    <description>Default configuration</description>
    <modules>
        <module>
            <name>Module name</name>
            <description>Module description</description>
            <properties>
                <property>
                    <name>Prop name</name>
                    <description>Prop description</description>
                    <key>prop.key</key>
                </property>
            </properties>
        </module>
    </modules>
</configuration>